# SPRINGER

- The data for TOP, CCF, CAS, JCR, and IF are sourced from [easyScholar](https://www.easyscholar.cc/).

## ECCV

|Publishers|Full/Homepage|Abbr/About|Acronym/Archive|Period/DBLP|Top|CCF|Submission|Days Left|Main Conf.|Days Left|Location|Keywords/Google|
|-         |-            |-         |-              |-          |-  |-  |-         |-        |          |-        |-       |-              |
|[SPRINGER](https://www.springer.com/)|[European Conference on Computer Vision](https://eccv.ecva.net/)|Proc. Eur. Conf. Comput. Vis.|[ECCV](https://link.springer.com/conference/eccv)|[1990 -](https://dblp.org/db/conf/eccv/index.html)|False|B|06/03/2026|**{{ diffDate('2026-03-06') }}**|[08/09/2026](https://eccv.ecva.net/)|**{{ diffDate('2026-09-08') }}**|Malmö, Sweden|[Computer Vision](https://www.google.com/search?q=Computer+Vision)|

```mermaid
---
config:
    xyChart:
        width: 1200
        height: 600
    themeVariables:
        xyChart:
            titleColor: "#ff0000"
---
xychart-beta
    title "ECCV"
    x-axis [2000, 2002, 2004, 2006, 2008, 2010, 2012, 2014, 2016, 2018, 2020, 2022, 2024]
    y-axis "Number of Papers"
    bar [116, 226, 188, 192, 244, 328, 408, 362, 415, 776, 1358, 1645, 2386]
    line [116, 226, 188, 192, 244, 328, 408, 362, 415, 776, 1358, 1645, 2386]
```

## EMO

|Publishers|Full/Homepage|Abbr/About|Acronym/Archive|Period/DBLP|Top|CCF|Submission|Days Left|Main Conf.|Days Left|Location|Keywords/Google|
|-         |-            |-         |-              |-          |-  |-  |-         |-        |          |-        |-       |-              |
|[SPRINGER](https://www.springer.com/)|International Conference on Evolutionary Multi-Criterion Optimization|Proc. Int. Conf. Evol. Multi-Criterion Optim.|[EMO](https://link.springer.com/conference/emo)|[2001 -](https://dblp.org/db/conf/emo/index.html)|False|||||||[Evolutionary Computation](https://www.google.com/search?q=Evolutionary+Computation)|

```mermaid
---
config:
    xyChart:
        width: 1200
        height: 600
    themeVariables:
        xyChart:
            titleColor: "#ff0000"
---
xychart-beta
    title "EMO"
    x-axis [2001, 2003, 2005, 2007, 2009, 2011, 2013, 2015, 2017, 2019, 2021, 2023, 2025]
    y-axis "Number of Papers"
    bar [49, 56, 61, 69, 44, 42, 61, 68, 46, 59, 61, 44, 38]
    line [49, 56, 61, 69, 44, 42, 61, 68, 46, 59, 61, 44, 38]
```

## EuroGP

|Publishers|Full/Homepage|Abbr/About|Acronym/Archive|Period/DBLP|Top|CCF|Submission|Days Left|Main Conf.|Days Left|Location|Keywords/Google|
|-         |-            |-         |-              |-          |-  |-  |-         |-        |          |-        |-       |-              |
|[SPRINGER](https://www.springer.com/)|[European Conference on Genetic Programming](https://www.evostar.org/)|Proc. Eur. Conf. Genet. Program.|[EuroGP](https://link.springer.com/conference/eurogp)|[1998 -](https://dblp.org/db/conf/eurogp/index.html)|False||01/11/2025|**{{ diffDate('2025-11-01') }}**|[08/04/2026](https://www.evostar.org/2026/eurogp/)|**{{ diffDate('2026-04-08') }}**|Toulouse, France|[Evolutionary Computation](https://www.google.com/search?q=Evolutionary+Computation)|

### Remarks

part of EvoStar

```mermaid
---
config:
    xyChart:
        width: 1200
        height: 600
    themeVariables:
        xyChart:
            titleColor: "#ff0000"
---
xychart-beta
    title "EuroGP"
    x-axis [2000, 2001, 2002, 2003, 2004, 2005, 2006, 2007, 2008, 2009, 2010, 2011, 2012, 2013, 2014, 2015, 2016, 2017, 2018, 2019, 2020, 2021, 2022, 2023, 2024, 2025]
    y-axis "Number of Papers"
    bar [27, 30, 32, 45, 38, 34, 32, 35, 31, 30, 28, 29, 23, 23, 20, 18, 19, 22, 19, 18, 18, 17, 19, 22, 13, 15]
    line [27, 30, 32, 45, 38, 34, 32, 35, 31, 30, 28, 29, 23, 23, 20, 18, 19, 22, 19, 18, 18, 17, 19, 22, 13, 15]
```

## EvoAPPS

|Publishers|Full/Homepage|Abbr/About|Acronym/Archive|Period/DBLP|Top|CCF|Submission|Days Left|Main Conf.|Days Left|Location|Keywords/Google|
|-         |-            |-         |-              |-          |-  |-  |-         |-        |          |-        |-       |-              |
|[SPRINGER](https://www.springer.com/)|[International Conference on Applications of Evolutionary Computation](https://www.evostar.org/)|Proc. Int. Conf. Appl. Evol. Comput.|[EvoAPPS](https://link.springer.com/conference/evoapplications)|[2010 -](https://dblp.org/db/conf/evoapps/index.html)|False||01/11/2025|**{{ diffDate('2025-11-01') }}**|[08/04/2026](https://www.evostar.org/2026/evoapps/)|**{{ diffDate('2026-04-08') }}**|Toulouse, France|[Evolutionary Computation](https://www.google.com/search?q=Evolutionary+Computation)|

### Remarks

part of EvoStar

```mermaid
---
config:
    xyChart:
        width: 1200
        height: 600
    themeVariables:
        xyChart:
            titleColor: "#ff0000"
---
xychart-beta
    title "EvoAPPS"
    x-axis [2010, 2011, 2012, 2013, 2014, 2015, 2016, 2017, 2018, 2019, 2020, 2021, 2022, 2023, 2024, 2025]
    y-axis "Number of Papers"
    bar [109, 87, 54, 63, 77, 72, 74, 72, 59, 42, 44, 51, 46, 51, 51, 68]
    line [109, 87, 54, 63, 77, 72, 74, 72, 59, 42, 44, 51, 46, 51, 51, 68]
```

## EvoCOP

|Publishers|Full/Homepage|Abbr/About|Acronym/Archive|Period/DBLP|Top|CCF|Submission|Days Left|Main Conf.|Days Left|Location|Keywords/Google|
|-         |-            |-         |-              |-          |-  |-  |-         |-        |          |-        |-       |-              |
|[SPRINGER](https://www.springer.com/)|[Evolutionary Computation in Combinatorial Optimization](https://www.evostar.org/)|Proc. Eur. Conf. Evol. Comput. Comb. Optim.|[EvoCOP](https://link.springer.com/conference/evocop)|[2004 -](https://dblp.org/db/conf/evocop/index.html)|False||01/11/2025|**{{ diffDate('2025-11-01') }}**|[08/04/2026](https://www.evostar.org/2026/evocop/)|**{{ diffDate('2026-04-08') }}**|Toulouse, France|[Evolutionary Computation](https://www.google.com/search?q=Evolutionary+Computation)|

### Remarks

part of EvoStar

```mermaid
---
config:
    xyChart:
        width: 1200
        height: 600
    themeVariables:
        xyChart:
            titleColor: "#ff0000"
---
xychart-beta
    title "EvoCOP"
    x-axis [2004, 2005, 2006, 2007, 2008, 2009, 2010, 2011, 2012, 2013, 2014, 2015, 2016, 2017, 2018, 2019, 2020, 2021, 2022, 2023, 2024, 2025]
    y-axis "Number of Papers"
    bar [23, 24, 24, 21, 24, 21, 24, 22, 22, 23, 20, 19, 17, 16, 12, 13, 14, 14, 13, 15, 12, 16]
    line [23, 24, 24, 21, 24, 21, 24, 22, 22, 23, 20, 19, 17, 16, 12, 13, 14, 14, 13, 15, 12, 16]
```

## EvoMUSART

|Publishers|Full/Homepage|Abbr/About|Acronym/Archive|Period/DBLP|Top|CCF|Submission|Days Left|Main Conf.|Days Left|Location|Keywords/Google|
|-         |-            |-         |-              |-          |-  |-  |-         |-        |          |-        |-       |-              |
|[SPRINGER](https://www.springer.com/)|[Artificial Intelligence in Music, Sound, Art and Design](https://www.evostar.org/)|Proc. Int. Conf. Artif. Intell. Music, Sound, Art and Design|[EvoMUSART](https://link.springer.com/conference/evomusart)|[2012 -](https://dblp.org/db/conf/evomusart/index.html)|False||01/11/2025|**{{ diffDate('2025-11-01') }}**|[08/04/2026](https://www.evostar.org/2026/evomusart/)|**{{ diffDate('2026-04-08') }}**|Toulouse, France|[Evolutionary Computation](https://www.google.com/search?q=Evolutionary+Computation)|

### Remarks

part of EvoStar

```mermaid
---
config:
    xyChart:
        width: 1200
        height: 600
    themeVariables:
        xyChart:
            titleColor: "#ff0000"
---
xychart-beta
    title "EvoMUSART"
    x-axis [2012, 2013, 2014, 2015, 2016, 2017, 2018, 2019, 2020, 2021, 2022, 2023, 2024, 2025]
    y-axis "Number of Papers"
    bar [20, 16, 11, 23, 16, 24, 20, 16, 14, 31, 26, 27, 26, 28]
    line [20, 16, 11, 23, 16, 24, 20, 16, 14, 31, 26, 27, 26, 28]
```

## ICANN

|Publishers|Full/Homepage|Abbr/About|Acronym/Archive|Period/DBLP|Top|CCF|Submission|Days Left|Main Conf.|Days Left|Location|Keywords/Google|
|-         |-            |-         |-              |-          |-  |-  |-         |-        |          |-        |-       |-              |
|[SPRINGER](https://www.springer.com/)|[International Conference on Artificial Neural Networks](https://e-nns.org/)|[Proc. Int. Conf. Artif. Neural Netw. Mach. Learn.](https://e-nns.org/)|[ICANN](https://link.springer.com/conference/icann)|[1991 -](https://dblp.org/db/conf/icann/index.html)|False|C|16/09/2025|**{{ diffDate('2025-09-16') }}**|[27/09/2026](https://waset.org/artificial-neural-networks-conference-in-september-2026-in-hong-kong)|**{{ diffDate('2026-09-27') }}**|Hong Kong, China|[Neural Networks](https://www.google.com/search?q=Neural+Networks)|

```mermaid
---
config:
    xyChart:
        width: 1200
        height: 600
    themeVariables:
        xyChart:
            titleColor: "#ff0000"
---
xychart-beta
    title "ICANN"
    x-axis [2001, 2002, 2003, 2005, 2006, 2007, 2008, 2009, 2010, 2011, 2012, 2013, 2014, 2016, 2017, 2018, 2019, 2020, 2021, 2022, 2023, 2024, 2025]
    y-axis "Number of Papers"
    bar [174, 221, 139, 268, 208, 197, 203, 203, 218, 106, 162, 78, 105, 122, 128, 216, 241, 139, 265, 259, 458, 292, 190]
    line [174, 221, 139, 268, 208, 197, 203, 203, 218, 106, 162, 78, 105, 122, 128, 216, 241, 139, 265, 259, 458, 292, 190]
```

## ICSI

|Publishers|Full/Homepage|Abbr/About|Acronym/Archive|Period/DBLP|Top|CCF|Submission|Days Left|Main Conf.|Days Left|Location|Keywords/Google|
|-         |-            |-         |-              |-          |-  |-  |-         |-        |          |-        |-       |-              |
|[SPRINGER](https://www.springer.com/)|[International Conference on Swarm Intelligence](https://iasei.org/)|Proc. Int. Conf. Swarm Intell.|[ICSI](https://link.springer.com/conference/icsi)|[2010 -](https://dblp.org/db/conf/swarm/index.html)|False||18/04/2025|**{{ diffDate('2025-04-18') }}**|[11/07/2025](https://iasei.org/icsi2025/)|**{{ diffDate('2025-07-11') }}**|Yokohama, Japan|[Evolutionary Computation](https://www.google.com/search?q=Evolutionary+Computation); [Swarm Intelligence](https://www.google.com/search?q=Swarm+Intelligence)|

```mermaid
---
config:
    xyChart:
        width: 1200
        height: 600
    themeVariables:
        xyChart:
            titleColor: "#ff0000"
---
xychart-beta
    title "ICSI"
    x-axis [2010, 2011, 2012, 2013, 2014, 2015, 2016, 2017, 2018, 2019, 2020, 2021, 2022, 2023, 2024, 2025]
    y-axis "Number of Papers"
    bar [185, 143, 144, 129, 107, 165, 132, 133, 113, 82, 63, 104, 85, 81, 74, 54]
    line [185, 143, 144, 129, 107, 165, 132, 133, 113, 82, 63, 104, 85, 81, 74, 54]
```

## IJCCI

|Publishers|Full/Homepage|Abbr/About|Acronym/Archive|Period/DBLP|Top|CCF|Submission|Days Left|Main Conf.|Days Left|Location|Keywords/Google|
|-         |-            |-         |-              |-          |-  |-  |-         |-        |          |-        |-       |-              |
|[SPRINGER](https://www.springer.com/)|[International Joint Conference on Computational Intelligence](https://ijcci.scitevents.org/)|Proc. Int. Joint Conf. Comput. Intell.|[IJCCI](https://link.springer.com/conference/ijcci)|[2009 -](https://dblp.org/db/conf/ijcci/index.html)|False||19/05/2026|**{{ diffDate('2026-05-19') }}**|[28/10/2026](https://ijcci.scitevents.org/)|**{{ diffDate('2026-10-28') }}**|Angers, Frence|[Evolutionary Computation](https://www.google.com/search?q=Evolutionary+Computation)|

## PPSN

|Publishers|Full/Homepage|Abbr/About|Acronym/Archive|Period/DBLP|Top|CCF|Submission|Days Left|Main Conf.|Days Left|Location|Keywords/Google|
|-         |-            |-         |-              |-          |-  |-  |-         |-        |          |-        |-       |-              |
|[SPRINGER](https://www.springer.com/)|Parallel Problem Solving from Nature|Proc. Int. Conf. Parallel Probl. Solving Nat.|[PPSN](https://link.springer.com/conference/ppsn)|[1990 -](https://dblp.org/db/conf/ppsn/index.html)|False|B|28/03/2026|**{{ diffDate('2026-03-28') }}**|[29/08/2026](https://ppsn2026.disi.unitn.it/)|**{{ diffDate('2026-08-29') }}**|Trento, Italy|[Evolutionary Computation](https://www.google.com/search?q=Evolutionary+Computation)|

```mermaid
---
config:
    xyChart:
        width: 1200
        height: 600
    themeVariables:
        xyChart:
            titleColor: "#ff0000"
---
xychart-beta
    title "PPSN"
    x-axis [2000, 2002, 2004, 2006, 2008, 2010, 2012, 2014, 2016, 2018, 2020, 2022, 2024]
    y-axis "Number of Papers"
    bar [88, 90, 118, 106, 114, 128, 105, 93, 95, 81, 99, 85, 101]
    line [88, 90, 118, 106, 114, 128, 105, 93, 95, 81, 99, 85, 101]
```

